id,company,opinion,date,rating,source,score,sentiment
99,NARATO,"Cool projects with cool people,As this is my first job, I don't have much experience with different companies, their mentality, work-life balance, ... But what I do know is that I've enjoyed my time thus far at Narato, working on cool projects for massive companies as well as impactful projects at small companies, learning every step of the way. Sometimes working a little late cause ""this is some cool stuff we're building"" and other days stopping a little early to get a drink, a chat, a laugh, ... One of the harder parts for me personally, is the ever changing landscape that we developers call work. Narato tries to stay close to the border where the change is happening, taking steps in new and sometimes undocumented terrain. Whilst it is very cool to work with new tech, it can also be frustrating. The flipside of this coin is the great feeling that comes with fiddling with something new and it working afterwards, the great feeling of broadening your horizon. My personal nature wouldn't reach for all this new tech, so I have Narato to thank for presenting me the opportunity and giving me a little nudge. A final and quite important point when broadening your horizon and going on an adventure, is the captains steering the ship. And let me tell you, Narato has some excellent captains, placing themselves among the crew and not shying away from getting their hands dirty or having a pint. Genuine people that actually do care about the co-workers around them. Approachable when you have a problem that needs sorting out, whether it's something technical, practical, personal, ..., they'll do their very best to find a solution with you.Frequently changing work-environment",16/02/2021,5,indeed,0.9961,positive
100,NARATO,"Fun company working with cutting edge technology,No company hierarchy, everyone can give their input and is heard. People are encouraged to give ideas / feedback.Everyone helps each other out where he/she can.",16/02/2021,4,indeed,0.7845,positive
101,iFacto,"no annual evaluation, no career planning",06/01/2022,1,glassdoor,-0.5267,negative
102,Kohera,"Flexibility is a plus point, salary is lower than other companies",08/02/2022,5,glassdoor,0.0516,positive
103,Kohera,"Family, cool atmosphere, a lot of expertise, cannot immediately come up with something negative",05/06/2021,5,glassdoor,-0.34,negative
104,Kohera,"Sphere: find like -minded people who all share passion for Microsoft Data Platform. You can also be yourself, long live diversity in personalities! -Klein on Human Size Company (43P) with the backings and benefits of a large Cronos Group initiative and autonomy are by definition in the Consultantcy Role and in our company DNA. You learn quickly and keep learning through the variation in assignments. Consultancy is certainly not one -sided with us: something is wrong, then you can count on the willingness to listen., - We focus on Microsoft and monitor that limit not to lose our specialists role. Some people prefer to go wide and less deep. - We are still in growth process in terms of structure. If you like tight structures, then we are not your right employer. In any case, we love freedom than rules, so we may never be a control paradise :-) - If you are looking for the highest salary package, we are not for you. We believe in humanity, a good balance work/life and giving and making just about everything discussable. Our wage package fits in with that philosophy.",20/01/2020,4,glassdoor,0.9817,positive
105,Narato,"Freedom to take your responsibility.Curiosity and wonder are high on our list., There are too few hours in a day :-)",17/12/2021,5,glassdoor,0.7579,positive
106,PreviewLabs,"Coworkers are friendly and funFlexible work environment and hours, can accommodate your needsLarge variety in your work! No two days are the same. Enjoyable, creative work - inventive problem solving skills are celebrated, Employees are split across the United States and Belgium, which necessitates accommodations for the time zone differenceNot a precise 9-5 schedule - sometimes you'll need to work outside of those hours, and this can be somewhat unpredictable",26/03/2021,5,glassdoor,0.923,positive
107,PreviewLabs,"Bernard is a great employer. He is very easy to work with because he is good at communicating with you. He is good at conveying his thoughts and vision to you. He is very hands on and schedules regular meeting that will allow you to know where you stand and what is expected of you. He does not micromanage you., Bernard is very social and talkative because of this sometimes your meeting will run long.",12/01/2021,5,glassdoor,0.9432,positive
108,PreviewLabs,"Somewhat flexible work week (as long as you work a minimum of 38 hours, you can take off time during the day as needed to go to appointments, etc. and just work later another day to make up for it)., - micromanagement is OUT OF CONTROL- little business sense- frequently late/ missing deadlines- leadership has no time management skills- willing to listen* to other's opinions/ideas, but rarely willing to change.... I could make quite a long list. **Hire people to do their jobs and then let them do their jobs.** There is no reason that there should be so many meetings with employees all week to check in on what they are doing and review it. It's an incredible waste of time on everyone's part. There is a reason you are always late, missing events on your schedule, missing deadlines and working into the wee hours of the night - and causing others to do so with you. Develop trust with your employees. Make clear and understand that they will come to you or the PM with questions if needed, but hours a day get wasted unnecessarily. Pay attention to your employees. Work life balance... many aren't getting it. You want to be friends with your employees and expect them to hang out with you in your/their free time, but don't do much to earn that friendship. Practice listening; interrupt less; give people the chance to respond - this includes during [potential] client calls. Be patient. If you're going to be a global business, understand that business is conducted differently in various countries and learn the differences. R-E-S-P-E-C-T.",30/08/2020,2,glassdoor,0.5029,positive
109,Uptime Group,"Great team, Innovative spirit, Young people, Great to start your career, The opportunities to grow into management position were limited.",18/01/2019,4,glassdoor,0.926,positive
110,EWings,"smooth communication, Correct wage, I was allowed to decide how many texts I could translate within 18 hours, - I did not notice (telework)",21/08/2021,5,glassdoor,0.0,neutral
111,EWings,"working atmosphere, responsibility, team, challenging, instructive, no negatives established during internship",26/04/2021,5,glassdoor,-0.1531,negative
112,Roborana,"A lot of freedom but also a lot of responsibility!Nice assignments for beautiful customers, you can always develop and work with the latest techniques., Sometimes busy but you are always appreciated/rewarded for that",17/02/2022,5,glassdoor,0.8497,positive
113,Kazi,"Very collegial, very friendly people- opportunity to grow with the company- everyone very down-to-earth,- too much autonomy expected for a junior dev (personal opinion of course)- lack of framework (junior)",12/06/2018,4,glassdoor,0.6726,positive
114,Kazi,"Working environment is very good, Ease of task management & assign",05/03/2022,4,glassdoor,0.7159,positive
115,Kazi,"Good team work and awesome developer experience, Not any that I can think of",01/03/2021,5,glassdoor,0.7906,positive
116,Kazi,"Awesome working place and would recommend, Non since its an awesome working place",16/10/2018,5,glassdoor,0.8934,positive
117,Forward,"It is a company with many growth opportunities, a very good atmosphere and the remuneration & fringe benefits can also be there!, It is a strongly growing company with the corresponding growing pains.These are being treated at this moment, but it will take a while before they have been completely spread.",14/02/2021,5,glassdoor,0.7928,positive
118,Forward,"The team is young and dynamic, so there is sufficient relaxation and ambiance.You are immediately included in the group so that you immediately get a welcome feeling.You can also quickly walk with projects so that you can enjoy yourself smoothly and efficiently.In this way you quickly master the operation of the company.The company also fully supports self -development and give you every opportunity to make this possible., I have not experienced negatives yet.",08/01/2020,5,glassdoor,0.9501,positive
119,Forward,"Many opportunities as an employee to develop his own path through training and his own input.- Working as a consultant is very supported by recent and successful organizational methods.- An atmosphere where different consultants teach each other a lot of knowledge.- A young, dynamic atmosphere looking for the ideal way to call in every employee as well as possible.- An interesting wage package with many benefits., No negatives yet experienced.",18/11/2019,5,glassdoor,0.9485,positive
120,RMDY,"Friendly colleagues and a great working atmosphere, sometimes they are too busy with many projects.",14/11/2020,5,glassdoor,0.8074,positive
121,M2Q,"Cool colleagues in the office in a pleasant location siege for training + exam of a certificate, I had a contract after my internship that I really wanted to, but that never happened",11/02/2022,2,glassdoor,0.4215,positive
122,Kunlabora,"Everyone's opinion is taken into consideration even for major company decisions* Regular activities to get to know the colleagues which you are not working with on a daily basis* Highly skilled colleagues to learn from and share experience with, * Many opportunities to pick up work outside of your core task. People will help you, but even then be careful to not pick up more than you can handle.",22/04/2021,5,glassdoor,0.631,positive
123,PHPro,"Good atmosphere, quite ok salary for starters, planning culture, over-managed work sometimes has the opposite effect",04/07/2020,4,glassdoor,0.659,positive
124,PHPro,"Colleagues with a high expertise in  the language and the different popular domains the language applies to (e-commerce, websites, CMS, custom development).Good for gaining your first work experience, bad financially if you'd stay for 3+ years., A high pressure environment when working on internal projects, when you are placed at a client as a consultant this might not be an issue.The wage is not conform to the market rate. To give some examples; someone with 4y experience will earn a gross wage of 2270 euro/month, someone with 13y experience will earn 3200/month.Negotiating a wage increase is difficult since there is always the excuse that you need to get a certain certificate and that your current wage is similar to the others in the company (sad if true).",11/10/2019,3,glassdoor,-0.25,negative
125,PHPro,"Great structure with organization by managers, low wages.You need to adapt to the market",12/09/2019,4,glassdoor,0.4588,positive
126,BeWire,Best place to work!,2/5/2020,5,google,0.6696,positive
127,BeWire,Great Place To Work,2/5/2021,5,google,0.6249,positive
128,BeWire,"Best place to work at, period.",2/5/2018,5,google,0.6369,positive
129,BeWire,Great place to work.,2/5/2019,5,google,0.6249,positive
130,ChangeLab,Professional team of people-oriented consultants and (team) coaches!,21/4/2019,5,google,0.0,neutral
131,Craftworkz,Young dynamic company that supports customers keeping an edge on competition by letting technology speak for itself. Creative steps into the future and backed up by the Cronos group to cover for the more legacy platform integration. Attracts young talent and will grow rapidly over the next few years.,3/5/2019,4,google,0.9118,positive
132,Craftworkz,"Great people, really nice company with creative and top notch technologies.",3/5/2021,5,google,0.8977,positive
133,Craftworkz,Prototyping and chatbots done right!!,3/5/2019,5,google,0.0,neutral
134,Kunlabora,Awesome workplace with lots of interesting people!,3/5/2019,5,google,0.7959,positive
135,Kunlabora,The place to be for professional software,3/5/2019,5,google,0.0,neutral
136,Sidekick,At Sidekick you have come to the right place for professional but creative branding and optimal online & offline communication. They also bring great added value every time in the field of content creation!,3/12/2021,5,google,0.9586,positive
137,Sidekick,"Sidekick has a fresh take on the online presence in the market.Without having a deep substantive knowledge of our services, they have succeeded in portraying our story perfectly.Sidekick improved our appearance to the outside world in a fast, but qualitative way.",2/5/2017,5,google,0.7351,positive
138,Sidekick,Sidekick brought Be Bold to life. They created a strong visual identity for us that perfectly reflects our story in all communication materials.,2/5/2017,5,google,0.9022,positive
139,Sidekick,"Highly recommended for everyone, companies large and small, who are looking for support in the field of branding, copywriting, digital marketing, web design, graphic design etc!!",3/8/2021,5,google,0.6572,positive
140,Sidekick,Top team that is always ready to be creative and think along in the philosophy of the company. We keep going back to SideKick for every expansion to our concept. This way we are sure that we can always profile ourselves professionally to our customers,2/5/2018,5,google,0.8176,positive
141,Sidekick,"At the end of 2018, Sidekick started with a new logo and the development of a new website for Arinti. Very quickly we were on the same wavelength and the Sidekick team succeeded in converting our story into a fresh and powerful new house style. Thanks for the excellent cooperation!",3/5/2019,5,google,0.9299,positive
142,Sidekick,Very nice cooperation behind us in building our website!They are also always available afterwards for questions and help.,2/5/2020,5,google,0.7257,positive
143,Sidekick,Very positive and professional cooperation.To the point and very good insight into the design and purpose of the website.,2/5/2018,5,google,0.7956,positive
144,Sidekick,Thank you for the great website & Logo! Looking forward to working with you all again in the future!,3/12/2021,5,google,0.8011,positive
145,The Campus NV,"The technical coaching training was refreshing, given by a good coach with a passion for his subject. The training was short so you don't miss out on too much other work without having the feeling it was all crammed in to a small timeslot. There was room for discussion and 1 on 1 talks and guidance. Will look into other The Campus courses later",3/8/2021,5,google,0.7382,positive
146,The Campus NV,"We've had the pleasure of working with The Campus several times now. I would advise every data company to have a look at their training offerings. We've followed mostly AWS courses (both on-premise and online), which were always delivered by professionals with the highest quality. The benefit of those courses compared to online courses is clearly the interaction with the trainers and their ad-hoc adjustment to the level of the people in the class.",3/5/2021,5,google,0.8555,positive
147,Formica,"All possible extra legal benefits small company under large business family feeling, communication internally -layered system training and training",16/10/2020,3,glassdoor,0.5574,positive
148,V-IT,"Company q recognizes the employee, I have to say",27/04/2021,5,glassdoor,0.0,neutral
149,V-IT,"Good colleagues, fun working atmosphere, strong projects, commercial vehicle, meal vouchers, hospitalization insurance, wages is a bit on the low side, but goes up through experience and training.",07/08/2020,5,glassdoor,0.5719,positive
150,V-IT,"V-IT has fully supported me in my process to work as a freelancer.And I can count on them for new projects and continuity!, I can't list it",01/07/2018,5,glassdoor,0.4376,positive
151,IS4U,"Interesting IAM projects- Correct amount of time for (self-)study- Correct pay for a Cronos company- Good (professional) atmosphere amongst colleagues - Most managers/teamleaders are approachable, - Could use a little bit more mentoring for juniors- Are you working for the benefit of  IS4U or mainly for Cronos itself?",05/08/2019,4,glassdoor,0.802,positive
152,IS4U,"Smart and friendly bunch of colleagues- A Lot of internal learning opportunities with peers (unconferences,...)- You get a lot  of autonomy in what you do- Flexible about homework when it's possible- Cronos benefits, - Cronos disadvantages- Sometimes a bit chaotic in internal communication",02/08/2019,5,glassdoor,0.7269,positive
153,IS4U,"interesting IAM technologies- long-term projects- staff with good technical knowledge-interesting customers, - toxic & political atmosphere- lack of strategy-al lot of IQ and little EQ- managers/teamleaders are very ambitious",28/04/2019,2,glassdoor,0.7713,positive
154,Monin,"The main advantage lies in the possibility of being able to write about anything, the hardest part is to have ideas to cry",17/04/2022,4,glassdoor,-0.5994,negative
155,Monin,"Supportive colleague within department which promote growth, pack schedule whereby you need to race with time for a better OEE",29/04/2021,4,glassdoor,0.8519,positive
156,Jungle Minds,"good culture, good people, beautiful customers, company can grow in building in accounts",10/12/2018,4,glassdoor,0.8658,positive
157,Exsertus,Excellent service and always helpful when you are in need of some expertise!,08/05/2018,5,google,0.7777,positive
158,Jungle Minds,"Nice building, but at the very end of the street.",18/08/2018,4,google,0.2263,positive
159,Jungle Minds,Didn't make the best impression during the quotation process.,21/02/2017,1,google,-0.3544,negative
160,Jungle Minds,"Disclaimer: at the time of writing this review I've been working here for a year after being in the industry for over 8 years.After working as a lead developer in the more branding side of the digital realm It was really nice to see a company that embraces the user as a central point in the process. Co-client is truly co-client, even in the long run. The focus is not on making the client dependant on the agency but to grow together and finally go a ""merry"" separate way. As a developer I highly recommend them but I might not be the most objective source of information ;)",11/04/2017,5,google,0.8416,positive
161,Jungle Minds,Joined this company after five years of working as a freelancer. One of my better decisions in life. Come see what we can do for your customers :),15/02/2017,5,google,0.7906,positive
162,Jungle Minds,Awesome agency in Amsterdam! Always fun to work with/for them! 6 years already. And cool people as well.,18/03/2017,5,google,0.9078,positive
163,Jungle Minds,Great company to work with. Really helped in setting up our digital strategy and building our  ecommerce team,02/06/2017,5,google,0.6249,positive
164,Jungle Minds,Great place to work!,09/04/2017,5,google,0.6588,positive
165,Jungle Minds,Very kind company,12/04/2018,5,google,0.5709,positive
166,Providit,"cool colleagues-flat structure- modern office- much knowledge,- for the time being not in-house development",12/04/2022,5,glassdoor,0.3182,positive
167,Providit,"Young and driven group of colleagues internal knowledge sharing- most important outsystems partner in Belgium- much attention for personal growth and general satisfaction, generally few negatives, more internal project work is desirable",18/01/2022,5,glassdoor,0.8932,positive
168,Providit,"This is one of the few companies where the employee is central. Opening, honesty and commitment is very hard appreciated.Correct pay depending on performance and your personal growth.Which ensures a motivating factor.It's one of a child, there are few to no negatives to report.",14/01/2022,5,glassdoor,0.6644,positive
169,Providit,"Flexible working location/hour.- If you want to follow more courses you can get supports and trainings easily.- Friendly ambiance, Not being able to see colleagues often (due to Covid)",18/01/2022,5,glassdoor,0.7845,positive
170,Enginity,"Good professional organization with room for advancement, Must be an self-advocate to be recognized",09/02/2022,4,glassdoor,0.4404,positive
171,Enginity,"Excellent benefits and comparable salary, excellent company for benefits and training",25/04/2021,5,glassdoor,0.9118,positive
172,Calibrate,"very cool and respectful colleagues- Nice atmosphere- Training + coaching of colleagues- Flexible working hours- Good work structures are used (Agile)- If you come to the office, food will be provided for you.- Commercial vehicle, Frontend Validation says that I have to write something here, but I have no negatives to report yet.",11/10/2021,5,glassdoor,0.5312,positive
173,Calibrate,"Super nice colleagues you are sitting with an idea you can always imagine this and see what is possible to realize., There are none because if you have something to do, you will discuss this gwn open and transparent with management",13/08/2021,5,glassdoor,0.7717,positive
174,Calibrate,"All expected checkboxes of a modern medium -sized agency can be checked here.The big difference lies in two elements: 1. A pleasant, pleasant atmosphere. 2. Management treats you as a person and not as an FTE., High work pressure and sometimes too customer pleas.Here and there you can see growth pains in the business processes.",13/08/2021,4,glassdoor,0.34,positive
175,Cronos,"Salary is good. Comfortable location, no inconveniences. No disadvantages. No disadvantages.",17/02/2022,5,glassdoor,-0.5859,negative
176,Cronos,"Good atmosphere, good teams on interesting projects, salaries, missions not very detailed, no professional development",10/10/2021,3,glassdoor,0.8623,positive
177,Cronos,"Two days of linkedin training are required otherwise we leave you alone, the salary does not follow",25/06/2021,3,glassdoor,-0.296,negative
178,Cronos,"A very flexible structure, much more flexible than a more traditional company, the advantage is also the disadvantage. As soon as something happens against you, this flexibility will be used against you.",27/12/2018,4,glassdoor,0.6526,positive
179,Cronos,"Diversity,Problem Solving,Continuing Education,Interns take a dim view of an outside consultant",06/02/2016,3,glassdoor,0.0,neutral
180,Cronos,"Good work life balance. Lot of personal growth, You need to find your own way",05/04/2022,5,glassdoor,0.6705,positive
181,Cronos,"Group benefits. Lots of freedom.Horizontal structure, Weird company structure.Wage negotiations are tough.Horizontal structure and career path",25/03/2022,5,glassdoor,0.6808,positive
182,Cronos,"It's so so their, no one disturb you daily, Target is to High and no help",24/03/2022,3,glassdoor,-0.6688,negative
183,Cronos,"Good environment , good salary, No flexible hours, very short timelines",14/01/2022,5,glassdoor,0.6705,positive
184,Cronos,"Voiture- Assurance- Fuel card- Meal voucher- Education,- Client can be far- Flemish clients mostly",26/09/2021,5,glassdoor,0.34,positive
185,Cronos,"Organization is quite well. Laptop when you arrive..., As always, different kind of variety",19/07/2021,4,glassdoor,0.3384,positive
186,Cronos,"great place to work, always fun, nothign is bad at the cronos group",09/04/2021,5,glassdoor,0.5994,positive
187,Cronos,"Nice Team, lots to learn, low pay, limited growth possibilities",29/03/2021,3,glassdoor,0.25,positive
188,Cronos,"Good working environment for employees., High working hours is something to worry about.",28/03/2021,4,glassdoor,0.0,neutral
197,Cronos,"Nice team, lots to learn, Limited growth possibilities, low pay",29/03/2021,3,glassdoor,0.25,positive
199,Cronos,"Good atmosphere and a lot to learn, Mediocre Salary - Read the car policy carefully",14/02/2021,3,glassdoor,0.5267,positive
200,Cronos,"a lot of knowledge inside the group, many possibilities to find a job that you like, Big company takes some time to get to know the structure",29/01/2021,4,glassdoor,0.3612,positive
201,Cronos,"Lots of benefits in this company, Everyone is a ‘manager’ if you get a promotion",25/01/2021,4,glassdoor,0.3818,positive
202,Cronos,"any opportunity you can create for yourself, you can take. But you need to create your success yourself., Does not pay much compared to industry standards.",14/01/2021,4,glassdoor,0.8908,positive
203,Cronos,"Everyone gets a car, vacation, stability, It is difficult to get a raise",13/01/2021,5,glassdoor,-0.3612,negative
204,Cronos,"huge growth potential- lots of employee recognition and advancement- ability to have an impact and build processes- generally a positive and collaborative environment, - new industry and fast growth means sometimes processes and tools lag behind the need for them- fast and unpredictable changes in the market require constant attention and flexibility- work life balance can suffer at times",07/01/2021,4,glassdoor,0.836,positive
205,Cronos,"Flexibility, entrepreneurship, young company, freedom, humane management, Internal competition, confusing structure, no clear grow path",12/06/2020,4,glassdoor,0.7269,positive
206,Cronos,"Nothing at ALL GOOD from my experience, Pretending FULL of HIM self person who does not know anything about programming AT ALL, BUT FULLY protected by management.",21/04/2019,1,glassdoor,0.6823,positive
207,Cronos,"benefits, good salaries, hospital insurance, meal checks, avg salaries, many small companies",26/11/2018,5,glassdoor,0.6705,positive
208,Cronos,"variable, dynamic, new tech, interesting, supportive, less interesting for international profile",19/11/2017,3,glassdoor,0.8481,positive
