id,company,opinion,date,rating,source,score,sentiment
209,Cronos,"Growth and lots of events to learn- Stable income- Conferences and meetups are possible to attend- Company car but be careful with the car policy,- so much potential in the group, but the companies wont work together for the common interest- lots of promises, but only after 6 months they look into them and adjust them to their likings- bad communication",04/08/2016,3,glassdoor,0.714,positive
210,Cronos,"Only an absolute minimum of hierarchy which results in almost no overhead. Down-to-earth culture., Career options at some point become rather limited.",13/02/2016,4,glassdoor,-0.4228,negative
211,Cronos,"A lot of independence is given to the employees, some of the companies are at the edge of technology which is a great thing. Lots of events organized and plenty of benefits to pick from, Salary increase are considerably low and if you don't ask, you don't get. You get a new car every four years which is a long time but by no means an exception in Belgium. Oh and no Mercedes.",11/11/2015,4,glassdoor,-0.3174,negative
212,Cronos,"Good place to be in, The structure of the internal companies is too complex and can cause communication problems at least",14/09/2015,4,glassdoor,0.0516,positive
213,Cronos,"Salary is slightly higher, free food during lunch and all in all some of the colleagues are very nice to work with. Lots of opportunities to launch ideas as new competence centers or re-shift your career if you desire., Although not openly discussed leadership of the units obviously foster an insane level of internal competitiveness. People are encouraged to do actions that are borderline legal when doing contract negotiations. Leadership has far to less respect for their employees and have no problem abusing their position on the employment market to brake ones career if you go against their standards. I took me some time to realize but I'm happy I left when I could.",11/09/2015,1,glassdoor,0.8182,positive
214,Cronos,"Relaxing collaberation with collegues and peers. Good atmosphere to work in., Not clear about salary raises, bonus,.. Not a high starting salary.",28/04/2015,4,glassdoor,0.6015,positive
215,Cronos,"Lots of support for your own ideas from within, open door policy to get feedback, Lots of politics, nothing is given, you have to get it yourself. Work hard and demand what you deserve.",31/01/2015,4,glassdoor,0.2023,positive
216,Cronos,"Nice environment (innovative, progressive, inclusive), complex internal structures with cluster and subclusters",16/02/2022,4,glassdoor,0.4215,positive
217,Cronos,"Company car, benefits, network with tons of companies/people, training opportunities, Sinterklaasfeest, Career path is very horizontal",14/02/2022,5,glassdoor,0.6369,positive
218,Cronos,"flat structure- you determine the course of your career- the many sub-companies ensure that you can easily change employer while you still continue to work for Cronos- possibility to start your business yourself under Cronos without much risk,- performance appraisals andThe corresponding wage negotiations are often a measure for nothing.The amounts have already been laid down in advance.If you go all the way for a higher storage, you will get 50Eur more that year and the year later 50ur less.However, this is the case in every larger company.",05/02/2022,4,glassdoor,0.6124,positive
219,Cronos,"cool colleagues, dynamic atmosphere, a lot of variety, difficult negotiation on wages, expectations of recruitment not always realistic",21/01/2022,3,glassdoor,0.34,positive
220,Cronos,"Atmosphere, open, nice colleagues, Cronos benefits, low wages towards other companies.Difficult to negotiate",13/01/2022,2,glassdoor,0.5106,positive
221,Cronos,"Opportunities are available for entrepreneurship cooperation with people of high technical expertise level, organizational complex cooperation not always easy for each other",10/12/2021,4,glassdoor,0.05,positive
222,Cronos,"You can really develop yourself here, nice colleagues, dynamic atmosphere and a lot of variety.Here they have an eye for what you do and say, work pressure but that is the case in the entire IT sector",30/10/2021,5,glassdoor,0.2732,positive
223,Cronos,"A lot of knowledge spread over different companies, because you often sit with the customer, you can't benefit from the facilities that Cronos itself offers in the head office",07/09/2021,4,glassdoor,-0.357,negative
226,Cronos,"OK salary- many opportunities,- on someone else you earn more ...",01/02/2022,3,glassdoor,0.4466,positive
227,Cronos,"Entrepreneurship is rewarded & independently proceeding autonomously, wages are not in line with the market unfortunately",25/01/2022,4,glassdoor,0.2023,positive
230,Cronos,"Flexible, good work-life balance, professional helpful admin, company car with fuel card, pleasant atmosphere, few negatives, for those who want to earn a lot, this may not be the right place",03/09/2021,4,glassdoor,0.8807,positive
231,Cronos,"No top-down, but bottom-up structure.Inspiring working environment.Good working conditions.Many colleagues ground in good pleasant climate.There is room for self -development., Somewhat stiff, as a consultant you are constantly on the track for different customers.Employment varies from month to month.Furthermore, little to criticize.",02/08/2021,5,glassdoor,0.6925,positive
232,Cronos,"There is very good support in starting your own company. You get a lot of responsibility. A very innovative environment to work in, you must be able to find your way yourself and you are obliged to take initiative what is not easy for everyone",29/07/2021,5,glassdoor,0.7881,positive
233,Cronos,"Loose atmosphere, pleasant, empathy, group feeling, small -scale, wages, growth opportunities, juniors, bureaucracy, customers",20/07/2021,4,glassdoor,0.7717,positive
234,Cronos,"Great atmosphere and good to gain experience., Loon is not super and difficult negotiation for storage.",02/07/2021,3,glassdoor,0.8542,positive
235,Cronos,"Correct wage good benefits Fine Collegas (of course depends on the sub -company), 1 2 3 4 5",24/06/2021,5,glassdoor,0.743,positive
236,Cronos,"Many options for growing, the offer of extra legal benefits",12/05/2021,3,glassdoor,0.5859,positive
237,Cronos,"Work Life Balance Personal Development -sized customer portfolio Name recognition, being able to work with little structure yourself structure Set up.",10/05/2021,5,glassdoor,0.0,neutral
238,Cronos,"Commercial vehicle correct remuneration (for starters)+ horizontal business structure, career opportunities and growth possibilities are limited.- go-with-the-flow mentality.",05/05/2021,4,glassdoor,0.6369,positive
239,Cronos,"Very diverse good for their employees, few career opportunities, salary is somewhat lower",21/03/2021,5,glassdoor,0.5956,positive
240,Cronos,"Friendly staff with passion for IT., Sometimes no work/customers.Sit on the bench for a long time.",16/03/2021,5,glassdoor,0.6124,positive
241,Cronos,"Honest, many possibilities, many growth possibilities, smaller entities, business structures are still being sought",09/03/2021,5,glassdoor,0.7096,positive
242,Cronos,"Large company that has many extras in Facility Management, Cronos has various sub -companies.You have to be right to land with a good, many are government mentality",08/03/2021,2,glassdoor,0.4404,positive
243,Cronos,"Within Cronos you get a lot of autonomy and opportunities where you are coached in entrepreneurship, you should definitely take the initiative yourself.",17/02/2021,4,glassdoor,0.6486,positive
244,Cronos,"A huge amount of knowledge, large network, interesting alternation of projects, the remuneration is lower than usual if you are a starter profile.",18/01/2021,3,glassdoor,0.4215,positive
245,Cronos,"Flexibility Ownership Training IT Woning, homework Little structure long distance",15/01/2021,5,glassdoor,0.34,positive
246,Cronos,"Nice colleagues, lots of freedom, office facilities, bad management, low wages, many promises but few realizations",06/12/2020,2,glassdoor,0.3612,positive
247,Cronos,"Useful things learned.Close to home., Very bad employer, scolds employees, some people who have a contract dismissed them before they start, employees are constantly being replaced by other employees.They try to let their employees perform a lot of overtime without compensation.",30/10/2020,1,glassdoor,-0.2247,negative
248,Cronos,"There is a wide range of IT solutions, the internal competition is large",21/10/2020,3,glassdoor,0.1779,positive
249,Cronos,"Young and dynamic team, a lot of growth potential, little guidance for starters, sometimes grows too fast",26/08/2020,4,glassdoor,0.6369,positive
250,Cronos,"Flat structure.Openness.Flexible hours.Informal., Growth opportunities are limited.Little guidance.",10/08/2020,4,glassdoor,0.6369,positive
251,Cronos,"Interesting projects, experiences and training opportunities, consultancy-specific disadvantages such as journeys and changing projects",05/08/2020,4,glassdoor,0.3818,positive
252,Cronos,"Pay well as a starter business car opportunities within the group, no company culture precisions an employment agency poor internal communication between MPs and consultants lots of internal competition that causes conflicts",04/05/2020,3,glassdoor,-0.5574,negative
253,Cronos,"You decide your career at Cronos.You are not a number and you feel that effective.Flat management structure is not lied.They are all very approachable and they listen to you. A lot of room for training., Wages not at the best. Many part -companies with a different internal operation. Consultancy is and remains a strange animal.You can throw yourself 100% on your project with the customer, but if you want to earn a little more, this is often insufficient.You will be asked to spend some extra hours in the internal Cronos operation.This can be experienced as frustrating.",08/03/2020,4,glassdoor,-0.7265,negative
254,Cronos,"At Cronos there is a startup mentality and atmosphere, wages can be quite low.",07/02/2020,4,glassdoor,-0.3384,negative
255,Cronos,"Spacious budget for your own car, unlimited fuel card, separate business sphere. Starters start with lower wages than with similar employees.",05/02/2020,4,glassdoor,-0.296,negative
256,Cronos,"Guidance when drafting and execating business plan - working for your own idea, own initiative, - more 'tapping fingers' than 'thinking along'",23/01/2020,4,glassdoor,0.0,neutral
257,Cronos,"Nice flexible working atmosphere full of opportunities, remuneration seems to be less than other IT companies",20/01/2020,4,glassdoor,0.743,positive
258,Cronos,"Good remuneration, fine working atmosphere, easily accessible, hard work, always learning, a lot of competition",16/12/2019,5,glassdoor,0.6908,positive
259,Cronos,"An exciting range of benefits, Travelling a lot maybe required",09/12/2019,5,glassdoor,0.7003,positive
260,Cronos,"Pleasant working atmosphere, nice colleagues, good remuneration, little input about the projects in which you can cooperate as a consultant.Sometimes you end up with companies/jobs that you are not suitable for at all.On the other hand, it may be that you are projectless 'on the couch' for too long.",08/12/2019,3,glassdoor,0.9042,positive
261,Cronos,"Many opportunities to learn. By the structure of many small companies you stand out. Kleine teams with many great events., Because some things are arranged at Cronos level and Cronos is so large, it can sometimes take a long time before you get an answerOr before it is arranged.",13/11/2019,4,glassdoor,0.7717,positive
262,Cronos,"Good communication, freedom, car, young, start wage is less than other developers",27/10/2019,5,glassdoor,0.7964,positive
263,Cronos,"work hard, play hard and life is beautiful, not immediately negligence",26/10/2019,4,glassdoor,0.6705,positive
264,Cronos,"Many possibilities, flexible and dynamic., Not immediately the most clear business structure.",02/09/2019,5,glassdoor,0.5849,positive
265,Cronos,"Large group, atmosphere, fringe benefits, little transparency, internal competition, location",13/08/2019,3,glassdoor,0.3818,positive
266,Cronos,"Cronos stimulates entrepreneurship, gives autonomy., I don't see any negatives on my side.",05/08/2019,5,glassdoor,0.25,positive
267,Cronos,"Good atmosphere, many initiatives for employees, that is probably what is going on from company to company",21/07/2019,4,glassdoor,0.4404,positive
268,Cronos,"Commercial vehicle, meal allowance and other, - sometimes somewhat little structure due to overlapping competencies",06/06/2019,5,glassdoor,0.0,neutral
269,Cronos,"Open & transparent many possibilities for flexible information, at the moment no",27/05/2019,4,glassdoor,-0.0772,negative
270,Cronos,"name recognition, fun projects with interesting customers, interesting technology, poor management, a lot of internal politics, a lot of unhealthy competition between the secondary companies, have a big dunk of themselves",30/04/2019,2,glassdoor,0.296,positive
271,Cronos,"Good place for a lot of experience to be gone and good atmosphere, remuneration that subsidiaries can give to their employees is limited",02/04/2019,4,glassdoor,0.5994,positive
272,Cronos,"Multiple offices and a lot of possibility of working from home, internal competition, pure body shop, childish colleagues (CEO runs from meetings without communication), no vision, general lack of motivation.",17/02/2019,1,glassdoor,-0.2387,negative
273,Cronos,"Nice team with a varied range of customers, not good sales support from above",14/02/2019,5,glassdoor,-0.2177,negative
274,Cronos,"Many benefits, they really do everything they can to have as pleasant as possible during, before and after working hours, friendly employees, everything is possible, but you have to indicate what you want, everyone is very open to feedback and opportunitiesDiscussing., The whole tangle of companies sometimes makes it rather complicated to follow, some companies come across as ""wanting but not being able to"", wage increases rarely express themselves in gross wage increases.When you are rented to the customer as a consultant and you have to be on site with the customer, you will lose some feeling for the company.",21/01/2019,4,glassdoor,-0.3506,negative
275,Cronos,"Multiple offices to avoid traffic jams, managers do but what, no education or relevant competencies many internal competitiveness possibility of salary increase",27/12/2018,1,glassdoor,-0.1154,negative
276,Cronos,"An entrepreneurial company where collegiality & atmosphere is central., If you come from Ghent, the Kennedy tunnel can be detrimental.",03/12/2018,5,glassdoor,0.0,neutral
277,Cronos,"Different projects different sectors Good Work Life Balance, Lens -desirable Structural Location Head office (Kontich) Lunch possibilities Rivaleliveness",20/11/2018,4,glassdoor,0.6369,positive
278,Cronos,"Group Benefits: osteopath, coach, discounts, extra training+ activities for 'Cronosites': football, sports challenges, special events+ cronos HR is very approachable, active and helpful.+ Self -choosing company car with fuel card, which can also be used outside of working hours.+ Telephone bill, internet account sponsored by Cronos (up to a certain limit)+ dynamic atmosphere with many small businesses. - Salary can be better (Cronos imposes low borders at subsidiaries), experienced experienced employees in this way..- Pacific rooms with whiteboards are always occupied.",25/07/2018,4,glassdoor,0.9132,positive
279,Cronos,"Flat structure, innovative environment, many (continued) growth opportunities, large structure with little overview",18/07/2018,4,glassdoor,0.7964,positive
280,Cronos,"Excellent support -sized independence space for growth and learning, standard processes for employee internal companies that do similar work",17/07/2018,3,glassdoor,0.8402,positive
281,Cronos,"Everyone approachable.Many small businesses with opportunities and interesting shared projects., Smaller companies do not always start a Flighing start.Little search in the beginning.",23/06/2018,4,glassdoor,0.7717,positive
282,Cronos,"Many career opportunities, no particular diploma required, almost always commercial vehicle, good remuneration, ..., if you are sent to customers, you sometimes have been with the same customer for years",07/05/2018,4,glassdoor,0.5106,positive
283,Cronos,"Campus feeling in Kontich many satellite offices so that you can happen to mobility problems, many companies within the company",14/11/2017,3,glassdoor,-0.296,negative
284,Cronos,"Open corporate culture Despite the size of the company, a personal approach -related management deployment is rewarded, sometimes a rather chaotic number of government project organization can be more professional",05/11/2017,5,glassdoor,0.0772,positive
285,Cronos,"Many extralegal benefits such as organized family weekend, ski weekend, working with contracts of 38 hours, so you really have few vacation days",17/10/2017,4,glassdoor,0.3818,positive
286,Cronos,"Invest a lot in people and developing their growth potential, environment with many opportunities and possibilities, long-term vision, private company, a lot of personal freedom in the interpretation of the tasks, own initiative is appreciated and encouraged, warm people-oriented environment (feels like oneLarge family), not the best payer (although you get a lot in place), more transparency is allowed, not a great company for people who need a lot of structure and guidance (although that depends on where you end up within Cronos)",01/08/2017,5,glassdoor,0.9176,positive
287,Cronos,"Accelerator and Broeing Fair for Tech Talent + Informal Atmosphere + Company in full growth + Incredibly strong network organization of and for entrepreneurs + a lot of attention for Work-Life Balance and Health at Work + Fast Time-2-Market of new concepts and products + absolutely non-risk-Avers, so you can get started quickly with Bleeding Edge Technologies + Correct Salaris package with a lot of attention for fringe benefits + flat structure and direct access to top management, - any company that grows so fast has difficulty adjusting its structure accordingly, and thatAlso notice here",27/07/2017,5,glassdoor,0.9007,positive
288,Cronos,"Breed Inhouse Knowledge Many internal opportunities, Management Cultural Support can be better MEMPLE MANGENT POVES A lot of power to itself",25/04/2017,3,glassdoor,0.802,positive
289,Cronos,"Good breeding floor for future IT talent, a lot of internal experience and knowledge, less interesting remuneration and different mentality between sub -companies.",07/09/2016,4,glassdoor,0.7968,positive
290,Cronos,"Support employees, understanding in difficult situations, relaxed atmosphere with healthy stress at the right moments, open and social structure of company, extras that can be used outside of work, clear communication in time of crisis, we are looking for fast but fast butAlso sustainable solutions, new fresh ideas receive immediate support, sometimes disorderly situations, sometimes it stays with rapid solutions and the sustainable solution remains, because of the amount of groups and sister companies it is sometimes difficult to get an overview of what Cronos is doingis",11/08/2016,4,glassdoor,0.8658,positive
291,Cronos,"A few handy extra legal benefits Many companies, so a lot of job choice in Kontich with the possibility of working on worker is done a lot for you in terms of paperwork, not easily accessible with public transport divide, there is a huge difference with the working methods of companies, even if they work together/they do the same",10/08/2016,4,glassdoor,0.521,positive
292,Cronos,"Open and young corporate culture+ competitive salary package with company car+ innovative business spirit+ a lot of autonomy, - Every company has its own working method",28/07/2016,5,glassdoor,0.5574,positive
293,Cronos,"The horizontal structure ensures that you get many opportunities.Although Cronos has become very large, you will keep the feeling of working for a startup., You have no mapped career path like at other companies.If you are looking for it, you better start elsewhere.",03/05/2016,5,glassdoor,0.5719,positive
294,Cronos,"Horizontal structure small groups that share an expertise- good contact with management when you are present in headquarters, when you work for a long time as a consultant, it can be more difficult to have good contact with the home base.",27/02/2016,5,glassdoor,0.6378,positive
295,Cronos,"Large ecosystem with many competencies present throughout the group.- No management culture, so that top managers are also easily accessible.- Overview by many group companies is sometimes lost. You have to stand up for yourself.Gray mice get stuck at the same level. Consultancy world revolves around remuneration, cars, time sheets, ...- Great course of consultants due to too little involvement.",08/02/2016,4,glassdoor,0.4728,positive
296,Cronos,"Flat Hierarchy, without too much official hassle. ""Ordinary"" people without placing themselves above others. Technically very competent employees., Freagmented, competitive for themselves. Sum weak engagement from sales to your own consultants., few growth opportunities.",05/02/2016,3,glassdoor,0.8221,positive
297,Cronos,great employer. Started working straight out of school and still satisfied 10 years later,6/12/2018,5,facebook,0.8316,positive
298,Cronos,"very dynamic group, all companies are inspired by their founder!",6/10/2018,5,facebook,0.7495,positive
299,Cronos,Cronos isn't in the news much because it's going so well,9/12/2017,5,facebook,0.4101,positive
300,Cronos,It's fantastic how De Cronos Groep supports entrepreneurship.,19/10/2016,5,facebook,0.7269,positive
301,Cronos,Very nice office building and a great place to work,28/04/2020,4,google,0.8016,positive
302,Cronos,"Great place, great people!",28/06/2021,5,google,0.8588,positive
303,Cronos,Great work environment. All very smart people.,28/04/2017,5,google,0.796,positive
304,Cronos,Lots of talented people in once place.,28/04/2019,5,google,0.5106,positive
305,Cronos,One big family of creative people,28/04/2019,5,google,0.4404,positive
306,Cronos,Very good workplace for IT.,28/04/2018,5,google,0.4927,positive
307,Cronos,Great place to work.,28/04/2018,5,google,0.6249,positive
308,Cronos,Cool office location,28/04/2020,4,google,0.3182,positive
309,Cronos,Only finding the right office is a challenge.,28/04/2017,5,google,0.0772,positive
310,Cronos,TOP IT-firma !,28/04/2021,5,google,0.4263,positive
311,Cronos,The Best,28/04/2021,5,google,0.6369,positive
312,Cronos,Best Place to Work,28/04/2019,5,google,0.6369,positive
313,Cronos,Super service,28/04/2021,5,google,0.5994,positive
314,Cronos,My employer,28/04/2019,5,google,0.0,neutral
315,Cronos,"Founded in 1991, De Cronos Groep has evolved from a one-man company to a larger group with 7,000 employees. Originally, the group was founded for and by technology people with the explicit intention of helping those people grow, if desired, up to and including entrepreneurship. In the meantime, this mission statement has been broadened and the group has been enriched with people from the creative sector who communicate well with the 'business people' and who work perfectly together with De Cronos Groep IT people to arrive at the most creative and technologically best solution for customers. . The group is therefore continuously looking for creative, driven people and is always willing to listen to innovative ideas from potential entrepreneurs.",28/01/2022,5,google,0.9792,positive
316,Cronos,"Surprise our loyal IT partners, voila! You will no longer forget Colleagues 2.0 :-) # ICT @ themovies",28/04/2020,5,google,0.5707,positive
317,Cronos,Very friendly people!,21/04/2022,5,google,0.5838,positive
318,Cronos,"Very friendly, pleasant people, warmly welcomed and felt very welcome and in the right way motivated to go all the way because should there be something not clear they will be there to support and encourage me to to redo an extra online ""training"" so that it is also properly mastered.",28/04/2021,5,google,0.9693,positive
319,Cronos,"A top-notch IT company, many employees and a family atmosphere.",28/12/2021,5,google,0.0,neutral
320,Cronos,Cronos helps you with any IT question. Trustworthy partner.,28/04/2021,5,google,0.7351,positive
321,Cronos,"Here, business is driven for young and old by innovative, high-tech companies!",28/4/2019,3,google,0.4926,positive
322,Cronos,"Having worked for Cronos for 7 years, it really can't say a bad word about it",28/04/2020,5,google,0.4791,positive
323,Cronos,The company I work for. Always liked working here!,28/04/2019,5,google,0.4753,positive
324,Cronos,hacked,28/12/2021,1,google,-0.4019,negative
325,Cronos,The New Silicon Valley,28/04/2017,5,google,0.0,neutral
326,Cronos,"Busy people, little feedback. They promise a lot, but don't deliver.",28/04/2019,2,google,0.1326,positive
327,Cronos,Very cool project. lots of inspiration. Top!,28/04/2020,5,google,0.7955,positive
328,Cronos,Largest and best IT company in Belgium,28/04/2020,5,google,0.6369,positive
329,Cronos,"As far as I'm concerned, the best employer in Belgium",28/04/2017,5,google,0.6369,positive
330,Cronos,Enterprising and innovative company!,28/04/2021,5,google,0.7574,positive
331,Cronos,Good vision and working environment,28/04/2018,5,google,0.5994,positive
332,Cronos,Group of many small firms,28/04/2019,3,google,0.0,neutral
333,Cronos,Very friendly service,28/04/2018,5,google,0.5413,positive
334,Cronos,Top employer!,28/04/2021,5,google,0.2714,positive
335,Cronos,Nice dynamics,28/04/2018,5,google,0.5994,positive
336,Cronos,Nice welcome,28/04/2018,4,google,0.7003,positive
338,Cronos,"Great place, great people!",28/08/2021,5,google,0.8588,positive
339,Cronos,Great work environment. All very smart people,28/04/2017,5,google,0.796,positive
